team_ja,team_en,opp_team_ja,opp_team_en,1,2,3,4,5,6,7,8,9,10,11,12,13,14,15,total,win,loss,gameKind,date
中日ドラゴンズ,dragons,読売ジャイアンツ,giants,0,0,0,0,0,0,0,1,0,,,,,,,1,0,1,リーグ戦,2023-10-03
読売ジャイアンツ,giants,中日ドラゴンズ,dragons,2,0,0,0,0,0,0,1,0,,,,,,,3,1,0,リーグ戦,2023-10-03
千葉ロッテマリーンズ,lotte,埼玉西武ライオンズ,lions,0,0,0,0,0,0,1,0,0,,,,,,,1,0,1,リーグ戦,2023-10-03
埼玉西武ライオンズ,lions,千葉ロッテマリーンズ,lotte,0,2,0,0,0,2,0,0,0,,,,,,,4,1,0,リーグ戦,2023-10-03
福岡ソフトバンクホークス,hawks,東北楽天ゴールデンイーグルス,rakuten,3,0,0,0,0,0,0,4,X,,,,,,,7,1,0,リーグ戦,2023-10-03
東北楽天ゴールデンイーグルス,rakuten,福岡ソフトバンクホークス,hawks,0,0,0,0,0,0,0,1,2,,,,,,,3,0,1,リーグ戦,2023-10-03
