team_ja,team_en,opp_team_ja,opp_team_en,1,2,3,4,5,6,7,8,9,10,11,12,13,14,15,total,win,loss,gameKind,date
千葉ロッテマリーンズ,lotte,埼玉西武ライオンズ,lions,2,0,1,1,0,0,0,3,X,,,,,,,7,1,0,リーグ戦,2023-10-02
埼玉西武ライオンズ,lions,千葉ロッテマリーンズ,lotte,1,0,0,1,0,0,0,0,1,,,,,,,3,0,1,リーグ戦,2023-10-02
オリックス・バファローズ,orix,北海道日本ハムファイターズ,fighters,0,2,1,0,0,0,0,0,X,,,,,,,3,1,0,リーグ戦,2023-10-02
北海道日本ハムファイターズ,fighters,オリックス・バファローズ,orix,0,0,0,0,0,0,0,0,0,,,,,,,0,0,1,リーグ戦,2023-10-02
福岡ソフトバンクホークス,hawks,東北楽天ゴールデンイーグルス,rakuten,2,1,0,0,0,1,2,0,X,,,,,,,6,1,0,リーグ戦,2023-10-02
東北楽天ゴールデンイーグルス,rakuten,福岡ソフトバンクホークス,hawks,0,0,0,0,0,0,0,0,0,,,,,,,0,0,1,リーグ戦,2023-10-02
